{"schema_version":1,"report_date":"2026-10-11","generated_at":"2026-10-11T17:09:50Z","model":"GPT-6","research_mode":"hybrid","repository_commit":"b9e6798e25c81cdec4176ece0984638584ab24fc","method":"hybrid","enabled_sources":["GitHub","public web"],"input_snapshot":"data/research_snapshot.csv","input_snapshot_sha256":"f08ca585cd4f22f9f5c2194e03bde3122eb914d4af2dc9b5979669da3fa354b8","source_counts":{"opened":0,"primary":0},"candidates":[]}
